{
    "$schema": "http://json-schema.org/draft-07/schema",

    "type": "object",
    "required": ["slug", "name", "duration", "brackets"],
    "additionalProperties": false,
    "properties": {
        "$schema": { "type": "string", "format": "uri-reference" },

        "slug": { "$ref": "slug.schema.json" },
        "name": { "type": "string" },
        "duration": { "$ref": "daterange.schema.json" },
        "links": { "type": "array", "items": { "$ref": "extern-link.schema.json" } },
        "tags": { "type": "array", "items": { "$ref": "official-match.schema.json#/$defs/tag" } },
        "participants": { "type": "array", "items": { "$ref": "official-lineup.schema.json#/$defs/shorthand" } },
        "brackets": { "type": "array", "items": { "$ref": "official-bracket.schema.json" } },
        "note": { "type": "string" }
    }
}
