{
    "$schema": "../../schemas/official-event.schema.json",

    "slug": "esl-impact-cashcup-eu-2024-10",
    "name": "ESL Impact Cash Cup 2024: Europe #10",
    "duration": { "start": "2024-05-25", "end": "2024-05-26" },
    "links": [
        { "name": "Liquip.", "url": "https://liquipedia.net/counterstrike/ESL/Impact_Cash_Cup/2024/Europe/10" },
        { "name": "FACEIT", "url": "https://www.faceit.com/en/championship/451803dd-6708-43f8-8a5d-64786fda9ece" }
    ],
    "tags": ["impact"],
    "participants": [{ "shorthand": "nipi", "lineup": { "team": "nipi", "players": ["nayomy", "qiyarah", "ramziin", "spike", "vilga"] } }],
    "brackets": [
        {
            "slug": "r2",
            "name": "Round of 16",
            "matches": [
                {
                    "id": 1,
                    "date": "2024-05-25",
                    "lineups": { "team1": { "shorthand": "nipi" }, "team2": { "name": "Fifth Venom" } },
                    "links": [{ "name": "FACEIT", "url": "https://www.faceit.com/en/cs2/room/1-34d5bb33-a6c6-4e30-a824-d519dae4d1cf" }],
                    "maps": [{ "id": 1, "map": "mrg", "result": "13:0" }]
                }
            ]
        },
        {
            "slug": "r3",
            "name": "Round of 8",
            "matches": [
                {
                    "id": 1,
                    "date": "2024-05-26",
                    "lineups": { "team1": { "shorthand": "nipi" }, "team2": { "name": "5bites" } },
                    "links": [{ "name": "FACEIT", "url": "https://www.faceit.com/en/cs2/room/1-4e04625c-a96e-41cd-bc9d-c36563d07538" }],
                    "maps": [{ "id": 1, "map": "anc", "result": "13:4" }]
                }
            ]
        },
        {
            "slug": "r4",
            "name": "Semi-finals",
            "matches": [
                {
                    "id": 1,
                    "date": "2024-05-26",
                    "lineups": { "team1": { "shorthand": "nipi" }, "team2": { "name": "ex-FORZE Ladies" } },
                    "links": [{ "name": "FACEIT", "url": "https://www.faceit.com/en/cs2/room/1-333fd9db-ef87-4d69-969a-2ea4f16cf48b" }],
                    "maps": [
                        { "id": 1, "map": "anb", "result": "10:13" },
                        { "id": 2, "map": "anc", "result": "16:14" },
                        { "id": 3, "map": "mrg", "result": "13:9" }
                    ]
                }
            ]
        },
        {
            "slug": "r4",
            "matches": [
                {
                    "id": 1,
                    "name": "Grand Final",
                    "date": "2024-05-26",
                    "lineups": { "team1": { "shorthand": "nipi" }, "team2": { "name": "Crescent" } },
                    "links": [{ "name": "FACEIT", "url": "https://www.faceit.com/en/cs2/room/1-ecdea9a2-2b2d-4f2c-ab71-e2e5de1f0209" }],
                    "maps": [
                        { "id": 1, "map": "nuke", "result": "7:13" },
                        { "id": 2, "map": "anb", "result": "9:13" }
                    ]
                }
            ]
        }
    ]
}
