{
    "$schema": "../../schemas/official-event.schema.json",

    "slug": "esl-impact-cashcup-eu-2023-spring-1",
    "name": "ESL Impact Cash Cup: Europe - Spring 2023 #1",
    "duration": { "start": "2023-04-08", "end": "2023-04-09" },
    "links": [
        { "name": "Liquip.", "url": "https://liquipedia.net/counterstrike/ESL/Impact_Cash_Cup/Europe/2023/Spring/1" },
        { "name": "ESEA", "url": "https://play.esea.net/events/2412" },
        { "name": "Brackets", "url": "https://play.esea.net/index.php?s=events&d=brackets&id=2412" }
    ],
    "tags": ["impact"],
    "participants": [{ "shorthand": "nipi", "lineup": { "roster": "nipi-2023-1" } }],
    "brackets": [
        {
            "slug": "r2",
            "name": "R2",
            "matches": [
                {
                    "id": 1,
                    "date": "2023-04-08",
                    "lineups": { "team1": { "shorthand": "nipi" }, "team2": { "name": "Pasiba Esports" } },
                    "maps": [{ "id": 1, "map": "vtg", "result": "16:7", "links": [{ "name": "ESEA", "url": "https://play.esea.net/match/17047289" }] }]
                }
            ]
        },
        {
            "slug": "r3",
            "name": "R3",
            "matches": [
                {
                    "id": 1,
                    "date": "2023-04-08",
                    "lineups": { "team1": { "shorthand": "nipi" }, "team2": { "name": "YeYO" } },
                    "maps": [
                        { "id": 1, "map": "anc", "result": "16:14", "links": [{ "name": "ESEA", "url": "https://play.esea.net/match/17047298" }] },
                        { "id": 2, "map": "ovp", "result": "16:12", "links": [{ "name": "ESEA", "url": "https://play.esea.net/match/17047318" }] }
                    ]
                }
            ]
        },
        {
            "slug": "r4",
            "name": "R4",
            "matches": [
                {
                    "id": 1,
                    "date": "2023-04-09",
                    "lineups": { "team1": { "shorthand": "nipi" }, "team2": { "name": "Mixxxen" } },
                    "maps": [
                        { "id": 1, "map": "inf", "result": "16:13", "links": [{ "name": "ESEA", "url": "https://play.esea.net/match/17047426" }] },
                        { "id": 2, "map": "ovp", "result": "19:15", "links": [{ "name": "ESEA", "url": "https://play.esea.net/match/17047429" }] }
                    ]
                }
            ]
        }
    ]
}
