{
    "$schema": "../../schemas/official-event.schema.json",

    "slug": "elite-fe-3",
    "name": "ELITE FE #3",
    "duration": { "start": "2025-04-27", "end": "2025-04-27" },
    "links": [
        { "name": "Liquip.", "url": "https://liquipedia.net/counterstrike/ELITE_FE/3" },
        { "name": "FACEIT", "url": "https://www.faceit.com/en/championship/3bc894cd-b091-4bb9-97e1-9c2396d427d3" }
    ],
    "tags": ["impact"],
    "participants": [{ "shorthand": "nipi", "lineup": { "roster": "nipi-2024-2" } }],
    "brackets": [
        {
            "slug": "r1",
            "name": "Opening Round",
            "matches": [
                {
                    "id": 1,
                    "date": "2025-04-27",
                    "lineups": { "team1": { "shorthand": "nipi" }, "team2": { "name": "Apranik" } },
                    "links": [{ "name": "FACEIT", "url": "https://www.faceit.com/en/cs2/room/1-5550b6d3-7a42-4127-bb3c-46def18792ad" }],
                    "maps": [],
                    "note": "Apranik forfeited the match."
                }
            ]
        },
        {
            "slug": "r2b1",
            "name": "Upper Quarterfinals",
            "matches": [
                {
                    "id": 1,
                    "date": "2025-04-27",
                    "lineups": { "team1": { "shorthand": "nipi" }, "team2": { "name": "Spray and slay" } },
                    "links": [{ "name": "FACEIT", "url": "https://www.faceit.com/en/cs2/room/1-077c8edb-d10d-4ce9-ad05-599bb3614c52" }],
                    "maps": [{ "id": 1, "map": "inf", "result": "13:8" }]
                }
            ]
        },
        {
            "slug": "r3b1",
            "name": "Upper Semifinals",
            "matches": [
                {
                    "id": 1,
                    "date": "2025-04-27",
                    "lineups": { "team1": { "shorthand": "nipi" }, "team2": { "name": "noHYP3" } },
                    "links": [{ "name": "FACEIT", "url": "https://www.faceit.com/en/cs2/room/1-404938d6-ec38-4c72-97a2-1f48867f2150" }],
                    "maps": [{ "id": 1, "map": "mrg", "result": "13:9" }]
                }
            ]
        },
        {
            "slug": "r4b1",
            "name": "Upper Final",
            "matches": [
                {
                    "id": 1,
                    "date": "2025-04-27",
                    "lineups": { "team1": { "shorthand": "nipi" }, "team2": { "name": "Prototype Blaze" } },
                    "links": [{ "name": "FACEIT", "url": "https://www.faceit.com/en/cs2/room/1-efb5f3f8-bb1c-4570-886a-5ce19f936e7c" }],
                    "maps": [{ "id": 1, "map": "d2", "result": "13:10" }]
                }
            ]
        },
        {
            "slug": "r5",
            "name": "Grand Final",
            "matches": [
                {
                    "id": 1,
                    "date": "2025-04-27",
                    "lineups": { "team1": { "shorthand": "nipi" }, "team2": { "name": "Prototype Blaze" } },
                    "maps": [
                        {
                            "id": 1,
                            "map": "anc",
                            "result": "13:11",
                            "links": [{ "name": "FACEIT", "url": "https://www.faceit.com/en/cs2/room/1-0de33fa5-ac0b-4058-8500-2d4ed11ed8fe/scoreboard" }]
                        },
                        {
                            "id": 2,
                            "map": "trn",
                            "result": "13:4",
                            "links": [{ "name": "FACEIT", "url": "https://www.faceit.com/en/match/room/1-efeebb9f-5f93-4b52-8b3c-3005b534e559" }]
                        }
                    ]
                }
            ]
        }
    ]
}
