{
    "$schema": "../../schemas/official-event.schema.json",

    "slug": "tradeit-league-fe-masters-2",
    "name": "Tradeit League FE Masters #2",
    "duration": { "start": "2024-04-06", "end": "2024-04-07" },
    "links": [
        { "name": "Liquip.", "url": "https://liquipedia.net/counterstrike/Tradeit_League/FE_Masters/2" },
        { "name": "FACEIT", "url": "https://www.faceit.com/en/championship/d74fc0f8-f6be-430a-aa21-3a74a05c1ef1" }
    ],
    "tags": ["impact"],
    "participants": [{ "shorthand": "nipi", "lineup": { "roster": "nipi-2024-1" } }],
    "brackets": [
        {
            "slug": "r1",
            "name": "Round of 16",
            "matches": [
                {
                    "id": 8,
                    "date": "2024-04-06",
                    "lineups": { "team1": { "shorthand": "nipi" }, "team2": { "name": "Nemesis" } },
                    "links": [{ "name": "FACEIT", "url": "https://www.faceit.com/en/cs2/room/1-cb446570-63d6-4db4-a2a7-38472396a6d0" }],
                    "maps": [
                        { "id": 1, "map": "anc", "result": "13:7" },
                        { "id": 2, "map": "mrg", "result": "13:3" }
                    ]
                }
            ]
        },
        {
            "slug": "r2",
            "name": "Round of 8",
            "matches": [
                {
                    "id": 4,
                    "date": "2024-04-06",
                    "lineups": { "team1": { "name": "GUILD" }, "team2": { "shorthand": "nipi" } },
                    "links": [{ "name": "FACEIT", "url": "https://www.faceit.com/en/cs2/room/1-095b1e83-aee6-4f23-868b-7d52890f3f45" }],
                    "maps": [
                        { "id": 1, "map": "mrg", "result": "4:13" },
                        { "id": 2, "map": "anb", "result": "13:7" },
                        { "id": 3, "map": "anc", "result": "6:13" }
                    ]
                }
            ]
        },
        {
            "slug": "r3",
            "name": "Semi-finals",
            "matches": [
                {
                    "id": 2,
                    "date": "2024-04-07",
                    "lineups": { "team1": { "name": "Fearless Cheetahs" }, "team2": { "shorthand": "nipi" } },
                    "links": [{ "name": "FACEIT", "url": "https://www.faceit.com/en/cs2/room/1-3b863ef6-9a9e-41d7-b3a9-04edafec72d4" }],
                    "maps": [
                        { "id": 1, "map": "nuke", "result": "5:13" },
                        { "id": 2, "map": "vtg", "result": "10:13" }
                    ]
                }
            ]
        },
        {
            "slug": "r4",
            "name": "Grand final",
            "tags": ["transparent"],
            "matches": [
                {
                    "id": 1,
                    "date": "2024-04-07",
                    "lineups": { "team1": { "name": "Pigeons" }, "team2": { "shorthand": "nipi" } },
                    "links": [{ "name": "FACEIT", "url": "https://www.faceit.com/en/cs2/room/1-7ef03d42-e212-43c3-bd99-acf200a2ec93" }],
                    "maps": [
                        { "id": 1, "map": "anc", "result": "13:10" },
                        { "id": 2, "map": "vtg", "result": "13:9" }
                    ]
                }
            ]
        }
    ]
}
