{
    "$schema": "../../schemas/official-event.schema.json",

    "slug": "esl-impact-cashcup-eu-2023-autumn-1",
    "name": "ESL Impact Cash Cup: Europe - Autumn 2023 #1",
    "duration": { "start": "2023-09-30", "end": "2023-10-01" },
    "links": [
        { "name": "Liquip.", "url": "https://liquipedia.net/counterstrike/ESL/Impact_Cash_Cup/Europe/2023/Autumn/1" },
        { "name": "FACEIT", "url": "https://www.faceit.com/en/championship/1afd9553-3f4c-4b1a-9aee-3f18d5758aca" }
    ],
    "tags": ["impact"],
    "participants": [{ "shorthand": "nipi", "lineup": { "roster": "nipi-2023-2" } }],
    "brackets": [
        {
            "slug": "r2",
            "name": "Round 2",
            "matches": [
                {
                    "id": 1,
                    "date": "2023-09-30",
                    "lineups": { "team1": { "shorthand": "nipi" }, "team2": { "name": "PARTIZAN RED" } },
                    "links": [{ "name": "FACEIT", "url": "https://www.faceit.com/en/cs2/room/1-ef0c2590-9844-48d2-b37e-351f5ab0e82c" }],
                    "maps": [{ "id": 1, "map": "ovp", "result": "13:6" }]
                }
            ]
        },
        {
            "slug": "r3",
            "name": "Semi-finals",
            "matches": [
                {
                    "id": 1,
                    "date": "2023-09-30",
                    "lineups": { "team1": { "shorthand": "nipi" }, "team2": { "name": "Washington5M" } },
                    "links": [{ "name": "FACEIT", "url": "https://www.faceit.com/en/cs2/room/1-c484ea84-5766-4b52-b79a-dfd0fc36b087" }],
                    "maps": [
                        { "id": 1, "map": "nuke", "result": "10:13" },
                        { "id": 2, "map": "ovp", "result": "10:13" }
                    ]
                }
            ]
        }
    ]
}
