{
    "$schema": "../../schemas/official-event.schema.json",

    "slug": "elite-fe-2",
    "name": "ELITE FE #2",
    "duration": { "start": "2025-02-23", "end": "2025-02-23" },
    "links": [
        { "name": "Liquip.", "url": "https://liquipedia.net/counterstrike/ELITE_FE/2" },
        { "name": "FACEIT", "url": "https://www.faceit.com/en/championship/b9ae6415-8e84-4c0d-8845-782a582cbada" }
    ],
    "tags": ["impact"],
    "participants": [{ "shorthand": "nipi", "lineup": { "roster": "nipi-2024-2" } }],
    "brackets": [
        {
            "slug": "r1",
            "name": "Round of 16",
            "matches": [
                {
                    "id": 3,
                    "date": "2025-02-23",
                    "lineups": { "team1": { "shorthand": "nipi" }, "team2": { "name": "Outsiders" } },
                    "links": [{ "name": "FACEIT", "url": "https://www.faceit.com/en/cs2/room/1-c8360cfb-ba1f-4313-b9bc-60eb94206b87" }],
                    "maps": [{ "id": 1, "map": "anc", "result": "13:7" }]
                }
            ]
        },
        {
            "slug": "r2",
            "name": "Quarterfinals",
            "matches": [
                {
                    "id": 2,
                    "date": "2025-02-23",
                    "lineups": { "team1": { "shorthand": "nipi" }, "team2": { "name": "Needachance" } },
                    "links": [{ "name": "FACEIT", "url": "https://www.faceit.com/en/cs2/room/1-1246dcb8-6029-45e5-8048-675d6b7750f5" }],
                    "maps": [{ "id": 1, "map": "d2", "result": "13:0" }]
                }
            ]
        },
        {
            "slug": "r3",
            "name": "Semifinals",
            "matches": [
                {
                    "id": 1,
                    "date": "2025-02-23",
                    "lineups": { "team1": { "name": "also" }, "team2": { "shorthand": "nipi" } },
                    "links": [{ "name": "FACEIT", "url": "https://www.faceit.com/en/cs2/room/1-024287d2-8f7e-4268-8634-d1deea8c48ef" }],
                    "maps": [{ "id": 1, "map": "anb", "result": "3:13" }]
                }
            ]
        },
        {
            "slug": "r4",
            "name": "Grand Final",
            "matches": [
                {
                    "id": 1,
                    "date": "2025-02-23",
                    "lineups": { "team1": { "shorthand": "nipi" }, "team2": { "name": "Prototype Blaze" } },
                    "links": [{ "name": "FACEIT", "url": "https://www.faceit.com/en/cs2/room/1-3164e4de-e08a-4547-92ae-84d354406302" }],
                    "maps": [
                        { "id": 1, "map": "trn", "result": "13:6" },
                        { "id": 2, "map": "anb", "result": "13:8" }
                    ]
                }
            ]
        }
    ]
}
