{
    "$schema": "../../schemas/official-event.schema.json",

    "slug": "esl-impact-cashcup-eu-2023-spring-2",
    "name": "ESL Impact Cash Cup: Europe - Spring 2023 #2",
    "duration": { "start": "2023-04-22", "end": "2023-04-23" },
    "links": [
        { "name": "Liquip.", "url": "https://liquipedia.net/counterstrike/ESL/Impact_Cash_Cup/Europe/2023/Spring/2" },
        { "name": "ESEA", "url": "https://play.esea.net/events/2422" },
        { "name": "Brackets", "url": "https://play.esea.net/index.php?s=events&d=brackets&id=2422" }
    ],
    "tags": ["impact"],
    "participants": [{ "shorthand": "nipi", "lineup": { "roster": "nipi-2023-1" } }],
    "brackets": [
        {
            "slug": "r2",
            "name": "R2",
            "matches": [
                {
                    "id": 4,
                    "date": "2023-04-22",
                    "lineups": { "team1": { "name": "Larance" }, "team2": { "shorthand": "nipi" } },
                    "maps": [{ "id": 1, "map": "ovp", "result": "5:16", "links": [{ "name": "ESEA", "url": "https://play.esea.net/match/17053593" }] }]
                }
            ]
        },
        {
            "slug": "r3",
            "name": "R3",
            "matches": [
                {
                    "id": 2,
                    "date": "2023-04-22",
                    "lineups": { "team1": { "team": "cfs" }, "team2": { "shorthand": "nipi" } },
                    "maps": [
                        { "id": 1, "map": "inf", "result": "4:16", "links": [{ "name": "ESEA", "url": "https://play.esea.net/match/17053635" }] },
                        { "id": 2, "map": "ovp", "result": "11:16", "links": [{ "name": "ESEA", "url": "https://play.esea.net/match/17053661" }] }
                    ]
                }
            ]
        },
        {
            "slug": "r4",
            "name": "R4",
            "matches": [
                {
                    "id": 1,
                    "date": "2023-04-23",
                    "lineups": { "team1": { "name": "NAVI Javelins" }, "team2": { "shorthand": "nipi" } },
                    "maps": [
                        { "id": 1, "map": "inf", "result": "1:16", "links": [{ "name": "ESEA", "url": "https://play.esea.net/match/17053774" }] },
                        { "id": 2, "map": "anc", "result": "16:10", "links": [{ "name": "ESEA", "url": "https://play.esea.net/match/17053780" }] },
                        { "id": 3, "map": "mrg", "result": "16:9", "links": [{ "name": "ESEA", "url": "https://play.esea.net/match/17053787" }] }
                    ]
                }
            ]
        }
    ]
}
