{
    "$schema": "../../schemas/official-event.schema.json",

    "slug": "esl-impact-cashcup-eu-2023-winter-6",
    "name": "ESL Impact Cash Cup: Europe - Winter 2023 #6",
    "duration": { "start": "2023-03-25", "end": "2023-03-26" },
    "links": [
        { "name": "Liquip.", "url": "https://liquipedia.net/counterstrike/ESL/Impact_Cash_Cup/Europe/2023/Winter/6" },
        { "name": "ESEA", "url": "https://play.esea.net/events/2192" },
        { "name": "Brackets", "url": "https://play.esea.net/index.php?s=events&d=brackets&id=2192" }
    ],
    "tags": ["impact"],
    "participants": [{ "shorthand": "nipi", "lineup": { "roster": "nipi-2023-1" } }],
    "brackets": [
        {
            "slug": "r1",
            "name": "R1",
            "matches": [
                {
                    "id": 8,
                    "date": "2023-03-25",
                    "lineups": { "team1": { "shorthand": "nipi" }, "team2": { "name": "5ye70log1" } },
                    "maps": [{ "id": 1, "map": "ovp", "result": "16:1", "links": [{ "name": "ESEA", "url": "https://play.esea.net/match/17043170" }] }]
                }
            ]
        },
        {
            "slug": "r2",
            "name": "R2",
            "matches": [
                {
                    "id": 4,
                    "date": "2023-03-25",
                    "lineups": { "team1": { "name": "YeYO" }, "team2": { "shorthand": "nipi" } },
                    "maps": [{ "id": 1, "map": "anb", "result": "12:16", "links": [{ "name": "ESEA", "url": "https://play.esea.net/match/17043202" }] }]
                }
            ]
        },
        {
            "slug": "r3",
            "name": "R3",
            "matches": [
                {
                    "id": 2,
                    "date": "2023-03-25",
                    "lineups": { "team1": { "name": "Astralis W" }, "team2": { "shorthand": "nipi" } },
                    "maps": [
                        { "id": 1, "map": "anc", "result": "6:16", "links": [{ "name": "ESEA", "url": "https://play.esea.net/match/17043224" }] },
                        { "id": 2, "map": "mrg", "result": "15:19", "links": [{ "name": "ESEA", "url": "https://play.esea.net/match/17043239" }] }
                    ]
                }
            ]
        },
        {
            "slug": "r4",
            "name": "R4",
            "matches": [
                {
                    "id": 1,
                    "date": "2023-03-26",
                    "lineups": { "team1": { "name": "9 Pandas Fearless" }, "team2": { "shorthand": "nipi" } },
                    "maps": [
                        { "id": 1, "map": "vtg", "result": "16:10", "links": [{ "name": "ESEA", "url": "https://play.esea.net/match/17043338" }] },
                        { "id": 2, "map": "mrg", "result": "14:16", "links": [{ "name": "ESEA", "url": "https://play.esea.net/match/17043350" }] },
                        { "id": 3, "map": "anb", "result": "16:14", "links": [{ "name": "ESEA", "url": "https://play.esea.net/match/17043356" }] }
                    ]
                }
            ]
        }
    ]
}
