{
    "$schema": "../../schemas/official-event.schema.json",

    "slug": "tradeit-league-fe-masters-3",
    "name": "Tradeit League FE Masters #3",
    "duration": { "start": "2024-05-18", "end": "2024-05-19" },
    "links": [
        { "name": "Liquip.", "url": "https://liquipedia.net/counterstrike/Tradeit_League/FE_Masters/3" },
        { "name": "FACEIT", "url": "https://www.faceit.com/en/championship/3c610442-0b27-43d9-8e06-4a57c01beaae" }
    ],
    "tags": ["impact"],
    "participants": [{ "shorthand": "nipi", "lineup": { "roster": "nipi-2024-2" } }],
    "brackets": [
        {
            "slug": "r1",
            "name": "Round of 16",
            "matches": [
                {
                    "id": 3,
                    "date": "2024-05-18",
                    "lineups": { "team1": { "shorthand": "nipi" }, "team2": { "name": "Let Her Cook" } },
                    "links": [{ "name": "FACEIT", "url": "https://www.faceit.com/en/cs2/room/1-0c82cbd9-6f6b-41e3-a313-775aa3036178" }],
                    "maps": [
                        { "id": 1, "map": "anc", "result": "5:13" },
                        { "id": 2, "map": "vtg", "result": "13:8" },
                        { "id": 3, "map": "anb", "result": "13:11" }
                    ]
                }
            ]
        },
        {
            "slug": "r2",
            "name": "Round of 8",
            "matches": [
                {
                    "id": 2,
                    "date": "2024-05-18",
                    "lineups": { "team1": { "shorthand": "nipi" }, "team2": { "name": "ex-GUILD" } },
                    "links": [{ "name": "FACEIT", "url": "https://www.faceit.com/en/cs2/room/1-184d0167-75ac-4f2c-9956-f21490e5119e" }],
                    "maps": [
                        { "id": 1, "map": "mrg", "result": "13:16" },
                        { "id": 2, "map": "inf", "result": "13:5" },
                        { "id": 3, "map": "anb", "result": "13:10" }
                    ]
                }
            ]
        },
        {
            "slug": "r3",
            "name": "Semi-finals",
            "matches": [
                {
                    "id": 1,
                    "date": "2024-05-19",
                    "lineups": { "team1": { "name": "Pigeons" }, "team2": { "shorthand": "nipi" } },
                    "links": [{ "name": "FACEIT", "url": "https://www.faceit.com/en/cs2/room/1-05619703-15b1-45e6-8169-e668e9f81d1d" }],
                    "maps": [
                        { "id": 1, "map": "inf", "result": "13:9" },
                        { "id": 2, "map": "d2", "result": "13:9" }
                    ]
                }
            ]
        }
    ]
}
